
{
  "$schema": "https://json-schema.org/draft/2020-12/schema",
  "type": "object",
  "additionalProperties": false,
  "properties": {
    "items": {
      "type": "array",
      "items": {
        "$schema": "https://json-schema.org/draft/2020-12/schema",
        "type": "object",
        "additionalProperties": false,
        "properties": {
          "job_id": {
            "type": "string",
            "format": "uuid"
          },
          "watcher_id": {
            "type": "string",
            "format": "uuid"
          },
          "state": {
            "enum": [
              "DETECTED",
              "STABILIZING",
              "REGISTERED",
              "VALIDATING",
              "VALIDATED",
              "INVALID",
              "QUARANTINED",
              "PROCESSING",
              "PROCESSED",
              "DELIVERING",
              "DELIVERED",
              "RETRY_PENDING",
              "FAILED",
              "COMPLETED",
              "COMPLETED_WITH_DELIVERY_ERRORS"
            ]
          },
          "source_display_path": {
            "type": "string",
            "minLength": 1,
            "maxLength": 1024,
            "pattern": "^(?![A-Za-z]:)(?!.*\\\\)(?!.*(?:^|/)\\.\\.(?:/|$)).+$"
          },
          "created_at": {
            "type": "string",
            "pattern": "^\\d{4}-\\d{2}-\\d{2}T\\d{2}:\\d{2}:\\d{2}(?:\\.\\d{1,6})?Z$"
          },
          "updated_at": {
            "type": "string",
            "pattern": "^\\d{4}-\\d{2}-\\d{2}T\\d{2}:\\d{2}:\\d{2}(?:\\.\\d{1,6})?Z$"
          },
          "latest_error_code": {
            "type": [
              "string",
              "null"
            ],
            "maxLength": 64
          }
        },
        "required": [
          "job_id",
          "watcher_id",
          "state",
          "source_display_path",
          "created_at",
          "updated_at",
          "latest_error_code"
        ]
      }
    },
    "limit": {
      "type": "integer",
      "minimum": 1,
      "maximum": 500
    },
    "offset": {
      "type": "integer",
      "minimum": 0
    },
    "total": {
      "type": "integer",
      "minimum": 0
    },
    "correlation_id": {
      "type": "string",
      "format": "uuid"
    }
  },
  "required": [
    "items",
    "limit",
    "offset",
    "total",
    "correlation_id"
  ],
  "title": "JobListResponse"
}
