{
  "items": [
    {
      "job_id": "11111111-1111-4111-8111-111111111111",
      "watcher_id": "22222222-2222-4222-8222-222222222222",
      "state": "DETECTED",
      "source_display_path": "/demo/path",
      "created_at": "2026-04-25T23:55:00Z",
      "updated_at": "2026-04-25T23:55:00Z",
      "latest_error_code": "demo"
    }
  ],
  "limit": 1,
  "offset": 1,
  "total": 1,
  "correlation_id": "11111111-1111-4111-8111-111111111111"
}
